➜  ~ psql -h localhost -p 5432 -U postgres -d postgres

psql (14.19 (Homebrew))
Type "help" for help.

postgres=# \d students
                                          Table "public.students"
   Column   |          Type          | Collation | Nullable |                   Default                    
------------+------------------------+-----------+----------+----------------------------------------------
 student_id | integer                |           | not null | nextval('students_student_id_seq'::regclass)
 full_name  | character varying(100) |           |          | 
 email      | character varying(100) |           |          | 
 program    | character varying(50)  |           |          | 
Indexes:
    "students_pkey" PRIMARY KEY, btree (student_id)
Referenced by:
    TABLE "assignments" CONSTRAINT "assignments_student_id_fkey" FOREIGN KEY (student_id) REFERENCES students(student_id)
    TABLE "maintenance_requests" CONSTRAINT "maintenance_requests_student_id_fkey" FOREIGN KEY (student_id) REFERENCES students(student_id)
    TABLE "payments" CONSTRAINT "payments_student_id_fkey" FOREIGN KEY (student_id) REFERENCES students(student_id)

postgres=# SELECT * FROM students;
 student_id |   full_name    |      email      |       program        
------------+----------------+-----------------+----------------------
          1 | Ali Sina Jawid | alisina@auca.kg | Software Engineering
          2 | Murtaza Jawid  | murtaza@auca.kg | Data Science
(2 rows)

postgres=# ALTER TABLE students ADD COLUMN age INT;
ALTER TABLE
postgres=# UPDATE students SET age = 21 WHERE full_name = 'Alice Johnson';
UPDATE students SET age = 23 WHERE full_name = 'Bob Smith';
UPDATE 0
UPDATE 0
postgres=# SELECT * FROM students;
 student_id |   full_name    |      email      |       program        | age 
------------+----------------+-----------------+----------------------+-----
          1 | Ali Sina Jawid | alisina@auca.kg | Software Engineering |    
          2 | Murtaza Jawid  | murtaza@auca.kg | Data Science         |    
(2 rows)

postgres=# \q